{
  "schema_version": 1,
  "feature": "provider-architecture-parity",
  "generated_at": "2026-05-24",
  "providers": [
    "claude",
    "gemini",
    "kimi",
    "grok",
    "deepseek",
    "glm"
  ],
  "policy_areas": [
    {
      "name": "route/auth/source-send approval",
      "module": "scripts/lib/provider-route-policy.mjs",
      "interface": "buildProviderPolicyContract, selectProviderRoute, normalizeApprovalScope, resolveAuthSelection",
      "implementation": "Shared route policy models the subscription -> direct_api -> openrouter ladder for all providers through Adapter capability facts and records route_step, route_steps, auth, billing, fallback, and source-send approval fields.",
      "adapters": [
        "claude",
        "gemini",
        "kimi",
        "grok",
        "deepseek",
        "glm"
      ],
      "packaged_copies": [
        "plugins/*/scripts/lib/provider-route-policy.mjs",
        "plugins/claude/scripts/lib/auth-selection.mjs",
        "plugins/gemini/scripts/lib/auth-selection.mjs"
      ],
      "sync_guard": "npm run lint:sync runs sync-provider-route-policy.mjs --check and sync-auth-selection.mjs --check",
      "tests": [
        "tests/unit/provider-route-policy.test.mjs",
        "tests/unit/plugin-copies-in-sync.test.mjs",
        "tests/unit/external-model-contracts.test.mjs"
      ],
      "verdict": "compliant_shared_policy",
      "drift_risk": "low",
      "missing_guardrail": null
    },
    {
      "name": "packet budgets",
      "module": "scripts/lib/review-prompt.mjs",
      "interface": "buildReviewPrompt, buildReviewAuditManifest, evaluateSourcePacketPolicy",
      "implementation": "Shared source packet policy records source_packet_budget_bytes, selected_source_bytes, source_packet_within_budget, source_packet_action, resend_confirmation_required, review_surface_changed, and source_content_transmission. It blocks over-budget source-bearing packets before source send, blocks automatic resend after source-sent failures unless explicitly confirmed or narrowed, uses shared git diff packets for branch-diff review across subscription and direct API paths, and permits same-session no-source repair for substantive invalid-verdict prose without losing the original source attempt across failed no-source repair chains.",
      "adapters": [
        "claude",
        "gemini",
        "kimi",
        "grok",
        "deepseek",
        "glm"
      ],
      "packaged_copies": [
        "plugins/*/scripts/lib/review-prompt.mjs"
      ],
      "sync_guard": "npm run lint:sync runs sync-review-prompt.mjs --check",
      "tests": [
        "tests/unit/provider-route-policy.test.mjs",
        "tests/unit/review-prompt.test.mjs",
        "tests/smoke/claude-companion.smoke.test.mjs",
        "tests/smoke/gemini-companion.smoke.test.mjs",
        "tests/smoke/kimi-companion.smoke.test.mjs",
        "tests/smoke/grok-web.smoke.test.mjs",
        "tests/smoke/api-reviewers.smoke.test.mjs",
        "tests/unit/plugin-copies-in-sync.test.mjs"
      ],
      "verdict": "compliant_shared_policy",
      "drift_risk": "low",
      "missing_guardrail": null
    },
    {
      "name": "review prompt contracts",
      "module": "scripts/lib/review-prompt.mjs",
      "interface": "buildReviewPrompt contractStyle=standard|compact, buildReviewAuditManifest",
      "implementation": "Shared review prompt construction owns both standard and compact delegated-review contracts. Adapters may select a contract style only as a documented Adapter capability fact; both styles preserve the same verdict, selected-source inspection, finding separation, runtime completeness, no-edit, and audit-quality semantics.",
      "adapters": [
        "claude",
        "gemini",
        "kimi",
        "grok",
        "deepseek",
        "glm"
      ],
      "packaged_copies": [
        "plugins/*/scripts/lib/review-prompt.mjs"
      ],
      "sync_guard": "npm run lint:sync runs sync-review-prompt.mjs --check",
      "tests": [
        "tests/unit/review-prompt.test.mjs",
        "tests/smoke/kimi-companion.smoke.test.mjs",
        "tests/unit/plugin-copies-in-sync.test.mjs",
        "tests/unit/docs-contracts.test.mjs"
      ],
      "verdict": "compliant_shared_policy",
      "drift_risk": "low",
      "missing_guardrail": null
    },
    {
      "name": "fallback semantics",
      "module": "scripts/lib/provider-route-policy.mjs plus provider Adapters",
      "interface": "shared route ladder fallback ledger: subscription -> direct_api -> openrouter",
      "implementation": "Shared route ladder records attempted, selected, skipped_reason, and fallback_reason for subscription, direct_api, and openrouter. Adapter-specific transport choices, such as Grok CLI/web auto, are documented capability facts inside the selected shared route rather than alternate provider policy.",
      "adapters": [
        "claude",
        "gemini",
        "kimi",
        "grok",
        "deepseek",
        "glm"
      ],
      "packaged_copies": null,
      "sync_guard": null,
      "tests": [
        "tests/unit/provider-route-policy.test.mjs",
        "tests/smoke/grok-web.smoke.test.mjs",
        "tests/smoke/api-reviewers.smoke.test.mjs"
      ],
      "verdict": "compliant_shared_policy",
      "drift_risk": "low",
      "missing_guardrail": null
    },
    {
      "name": "failure taxonomy",
      "module": "scripts/lib/external-model-failure-core.mjs",
      "interface": "classifyCompanionExecution, classifyDirectApiExecution, buildExternalModelFailureDiagnostic",
      "implementation": "Shared classification maps runtime/provider failures to normalized external-model failure classes and suggested diagnostics.",
      "adapters": [
        "claude",
        "gemini",
        "kimi",
        "grok",
        "deepseek",
        "glm"
      ],
      "packaged_copies": [
        "plugins/*/scripts/lib/external-model-failure-core.mjs"
      ],
      "sync_guard": "npm run lint:sync runs sync-external-model-failure-classification.mjs --check",
      "tests": [
        "tests/unit/external-model-failure-core.test.mjs",
        "tests/unit/plugin-copies-in-sync.test.mjs"
      ],
      "verdict": "compliant_shared_policy",
      "drift_risk": "low",
      "missing_guardrail": null
    },
    {
      "name": "suggested actions",
      "module": "scripts/lib/external-model-failure-core.mjs",
      "interface": "buildExternalModelFailureDiagnostic",
      "implementation": "Shared failure diagnostics provide provider-neutral suggested_action text, with Grok-specific text preserving no paid API fallback.",
      "adapters": [
        "claude",
        "gemini",
        "kimi",
        "grok",
        "deepseek",
        "glm"
      ],
      "packaged_copies": [
        "plugins/*/scripts/lib/external-model-failure-core.mjs"
      ],
      "sync_guard": "npm run lint:sync runs sync-external-model-failure-classification.mjs --check",
      "tests": [
        "tests/unit/external-model-contracts.test.mjs",
        "tests/smoke/grok-web.smoke.test.mjs"
      ],
      "verdict": "compliant_shared_policy",
      "drift_risk": "low",
      "missing_guardrail": null
    },
    {
      "name": "audit fields",
      "module": "scripts/lib/review-prompt.mjs",
      "interface": "buildReviewAuditManifest",
      "implementation": "Review audit manifests record selected route, fallback reason, auth path, billing path, source approval state, source bearing, source transmission, and review-quality fields.",
      "adapters": [
        "claude",
        "gemini",
        "kimi",
        "grok",
        "deepseek",
        "glm"
      ],
      "packaged_copies": [
        "plugins/*/scripts/lib/review-prompt.mjs"
      ],
      "sync_guard": "npm run lint:sync runs sync-review-prompt.mjs --check",
      "tests": [
        "tests/unit/review-prompt.test.mjs",
        "tests/unit/external-model-contracts.test.mjs"
      ],
      "verdict": "compliant_shared_policy",
      "drift_risk": "low",
      "missing_guardrail": null
    },
    {
      "name": "review-quality gates",
      "module": "scripts/lib/external-model-review-quality.mjs",
      "interface": "reviewQualityFailureState, hasSubstantiveInvalidVerdictReason",
      "implementation": "Shared helper reports failed review slots and semantic failure reasons across companion, direct API, and Grok outputs.",
      "adapters": [
        "claude",
        "gemini",
        "kimi",
        "grok",
        "deepseek",
        "glm"
      ],
      "packaged_copies": [
        "plugins/*/scripts/lib/external-model-review-quality.mjs"
      ],
      "sync_guard": "npm run lint:sync runs sync-external-model-review-quality.mjs --check",
      "tests": [
        "tests/unit/external-model-review-quality.test.mjs",
        "tests/unit/plugin-copies-in-sync.test.mjs"
      ],
      "verdict": "compliant_shared_policy",
      "drift_risk": "low",
      "missing_guardrail": null
    },
    {
      "name": "status/UX normalization",
      "module": "scripts/lib/companion-common.mjs and scripts/lib/review-panel.mjs",
      "interface": "lifecycle markdown cards, review panel records, error envelope fields",
      "implementation": "Shared lifecycle and panel rendering contracts normalize provider, job, route, auth, billing, source, status, error, and suggested action fields.",
      "adapters": [
        "claude",
        "gemini",
        "kimi",
        "grok",
        "deepseek",
        "glm"
      ],
      "packaged_copies": [
        "plugins/*/scripts/lib/companion-common.mjs",
        "plugins/*/scripts/lib/review-panel.mjs"
      ],
      "sync_guard": "npm run lint:sync runs sync-companion-common.mjs --check and sync-review-panel.mjs --check",
      "tests": [
        "tests/unit/external-model-contracts.test.mjs",
        "tests/unit/plugin-copies-in-sync.test.mjs"
      ],
      "verdict": "compliant_shared_policy",
      "drift_risk": "low",
      "missing_guardrail": null
    },
    {